[
  {
    "agent_id": "agent-research",
    "attempt_id": "attempt-research-1",
    "attempt_number": 1,
    "checkpoint_ref": "checkpoint-ref://v9-3/research-1",
    "created_at": "2026-06-10T06:30:16Z",
    "error_ref": null,
    "orchestration_run_id": "orch-v9-3-290585a635d8",
    "previous_attempt_id": null,
    "schema_version": "v9_3.attempt_history_record.v1",
    "station_id": "station-research",
    "station_run_id": "station-run-research",
    "status": "succeeded"
  },
  {
    "agent_id": "agent-implementation",
    "attempt_id": "attempt-implementation-1",
    "attempt_number": 1,
    "checkpoint_ref": "checkpoint-ref://v9-3/implementation-1",
    "created_at": "2026-06-10T06:30:16Z",
    "error_ref": "error-ref://v9-3/worker-timeout",
    "orchestration_run_id": "orch-v9-3-290585a635d8",
    "previous_attempt_id": null,
    "schema_version": "v9_3.attempt_history_record.v1",
    "station_id": "station-implementation",
    "station_run_id": "station-run-implementation",
    "status": "failed"
  },
  {
    "agent_id": "agent-implementation",
    "attempt_id": "attempt-implementation-2",
    "attempt_number": 2,
    "checkpoint_ref": "checkpoint-ref://v9-3/implementation-2",
    "created_at": "2026-06-10T06:30:16Z",
    "error_ref": null,
    "orchestration_run_id": "orch-v9-3-290585a635d8",
    "previous_attempt_id": "attempt-implementation-1",
    "schema_version": "v9_3.attempt_history_record.v1",
    "station_id": "station-implementation",
    "station_run_id": "station-run-implementation-retry",
    "status": "recovered"
  },
  {
    "agent_id": "agent-review",
    "attempt_id": "attempt-review-1",
    "attempt_number": 1,
    "checkpoint_ref": "checkpoint-ref://v9-3/review-1",
    "created_at": "2026-06-10T06:30:16Z",
    "error_ref": null,
    "orchestration_run_id": "orch-v9-3-290585a635d8",
    "previous_attempt_id": null,
    "schema_version": "v9_3.attempt_history_record.v1",
    "station_id": "station-review",
    "station_run_id": "station-run-review",
    "status": "succeeded"
  },
  {
    "agent_id": "agent-synthesis",
    "attempt_id": "attempt-synthesis-1",
    "attempt_number": 1,
    "checkpoint_ref": "checkpoint-ref://v9-3/synthesis-1",
    "created_at": "2026-06-10T06:30:16Z",
    "error_ref": null,
    "orchestration_run_id": "orch-v9-3-290585a635d8",
    "previous_attempt_id": null,
    "schema_version": "v9_3.attempt_history_record.v1",
    "station_id": "station-synthesis",
    "station_run_id": "station-run-synthesis",
    "status": "succeeded"
  }
]
